{
  "id": "bulk-user-import-partial-success",
  "title": "Bulk User Import with Partial Success",
  "category": "backend",
  "difficulty": "easy",
  "description": "Create a bulk import endpoint that reports partial success without failing the entire batch.\n\n### Objective\nImplement the FastAPI service so the replayed evaluator requests pass exactly as specified.\n\n### Implement These Routes\n- `POST /users/import`\n\n### Request Replay (Executed In Order)\n1. `POST /users/import`\n   Request body: `{\"users\":[{\"email\":\"a@example.com\"},{\"email\":\"invalid-email\"}]}`\n   Expected status: `200`\n   Expected body: `{\"imported\":1,\"failed\":1}`\n\n2. `POST /users/import`\n   Request body: `{\"users\":[{\"email\":\"b@example.com\"},{\"email\":\"c@example.com\"}]}`\n   Expected status: `200`\n   Expected body: `{\"imported\":2,\"failed\":0}`\n\n3. `POST /users/import`\n   Request body: `{\"users\":[{\"email\":\"x\"},{\"email\":\"y\"}]}`\n   Expected status: `200`\n   Expected body: `{\"imported\":0,\"failed\":2}`\n\n### Candidate Expectations\n- Complete the TODOs in starter code and keep behavior deterministic across sequential requests.\n- Keep state in memory for this challenge; do not use SQL or external databases.\n- Return exact status codes and JSON response shapes expected by the replay tests.\n- Handle invalid or missing input defensively with stable JSON errors instead of crashes.\n\n### Starter Files You Can Edit\n- `app/main.py`\n\n### Done Criteria\n- All replayed request tests pass in order.\n- API behavior matches the required contracts exactly.",
  "constraints": "- Python 3.11+\n- No SQL or external database usage\n- Deterministic outputs for graded requests",
  "hints": [
    "Validate each row independently.",
    "Do not stop processing after first invalid row."
  ],
  "tags": [
    "backend",
    "python",
    "fastapi",
    "bulk-operations",
    "error-reporting"
  ],
  "starter_files": [
    {
      "path": "app/main.py",
      "content": "from fastapi import FastAPI, HTTPException\nfrom typing import Any, Dict\n\napp = FastAPI(title=\"Bulk User Import with Partial Success\")\n\n# In-memory state for this challenge.\nSTATE: Dict[str, Any] = {}\n\n# TODO: Implement all required endpoints from the prompt.\n\n@app.post(\"/users/import\")\nasync def bulk_user_import_partial_success_post_users_import(payload: Dict[str, Any]):\n    raise HTTPException(status_code=501, detail=\"Not implemented\")\n",
      "language": "python",
      "readonly": false
    }
  ],
  "test_config": {
    "language": "python",
    "test_requests": [
      {
        "method": "POST",
        "path": "/users/import",
        "expected_status": 200,
        "expected_body": {
          "imported": 1,
          "failed": 1
        },
        "body": {
          "users": [
            {
              "email": "a@example.com"
            },
            {
              "email": "invalid-email"
            }
          ]
        }
      },
      {
        "method": "POST",
        "path": "/users/import",
        "expected_status": 200,
        "expected_body": {
          "imported": 2,
          "failed": 0
        },
        "body": {
          "users": [
            {
              "email": "b@example.com"
            },
            {
              "email": "c@example.com"
            }
          ]
        }
      },
      {
        "method": "POST",
        "path": "/users/import",
        "expected_status": 200,
        "expected_body": {
          "imported": 0,
          "failed": 2
        },
        "body": {
          "users": [
            {
              "email": "x"
            },
            {
              "email": "y"
            }
          ]
        }
      }
    ]
  },
  "solution_files": [],
  "sort_order": 4
}
