{
  "id": "css-flexbox-navbar",
  "title": "Flexbox Navbar",
  "category": "frontend",
  "difficulty": "easy",
  "description": "Write CSS to build a **responsive navigation bar** using Flexbox.\n\n### Visual Target\n\n```\n┌─────────────────────────────────────────────┐\n│  🔵 Logo    Home  About  Contact    [Login] │\n└─────────────────────────────────────────────┘\n```\n\n### Requirements\n\n- `.navbar` uses flexbox with items vertically centred\n- `.navbar` has a white background, `0 0 1rem 1.5rem` padding, and a bottom border of `1px solid #e5e7eb`\n- `.navbar__logo` is on the far **left**\n- `.navbar__links` are centred in the **middle** (use `flex: 1` and centred text/flex)\n- `.navbar__action` (the login button) is on the far **right**\n- Links have no list-style, display horizontally with `1.5rem` gap\n- Links are `#374151` colour, and the `.navbar__link--active` link is `#3b82f6`\n- The action button has a blue background (`#3b82f6`), white text, `0.5rem 1rem` padding, `0.375rem` border-radius, no border\n\n### Test IDs\n\n| Element | data-testid |\n|---------|-------------|\n| Navbar | `navbar` |\n| Logo | `logo` |\n| Links container | `links` |\n| Action button | `action` |",
  "constraints": "- Only edit styles.css\n- Use flexbox for the navbar layout\n- No JavaScript for layout or interaction",
  "hints": [
    "Set display: flex and align-items: center on the navbar.",
    "Give .navbar__links flex: 1 to make it fill the remaining space, then use display: flex and justify-content: center to centre the links.",
    "Use list-style: none and padding: 0 to remove default list styles, then display: flex with gap."
  ],
  "tags": ["css", "flexbox", "navbar", "layout"],
  "starter_files": [
    {
      "path": "App.tsx",
      "content": "import React from 'react';\nimport './styles.css';\n\nexport default function App() {\n  return (\n    <nav className=\"navbar\" data-testid=\"navbar\">\n      <div className=\"navbar__logo\" data-testid=\"logo\">\n        <span className=\"navbar__logo-icon\">🔵</span>\n        <span className=\"navbar__logo-text\">Brand</span>\n      </div>\n      <ul className=\"navbar__links\" data-testid=\"links\">\n        <li><a href=\"#\" className=\"navbar__link navbar__link--active\">Home</a></li>\n        <li><a href=\"#\" className=\"navbar__link\">About</a></li>\n        <li><a href=\"#\" className=\"navbar__link\">Contact</a></li>\n      </ul>\n      <div className=\"navbar__action\">\n        <button className=\"navbar__btn\" data-testid=\"action\">Login</button>\n      </div>\n    </nav>\n  );\n}\n",
      "language": "tsx",
      "readonly": true
    },
    {
      "path": "styles.css",
      "content": "/* === Navbar ===\n * TODO: Use flexbox, align items vertically centred\n * TODO: White background, padding 0 0 1rem 1.5rem\n * TODO: Bottom border: 1px solid #e5e7eb\n */\n.navbar {\n\n}\n\n/* === Logo ===\n * TODO: Display flex with centred items and 0.5rem gap\n * TODO: Font weight 600, font-size 1.125rem\n */\n.navbar__logo {\n\n}\n\n.navbar__logo-icon {\n  font-size: 1.25rem;\n}\n\n.navbar__logo-text {\n  color: #111827;\n}\n\n/* === Links ===\n * TODO: flex: 1 to fill space\n * TODO: Display flex, centred, gap 1.5rem\n * TODO: Remove list styles (list-style, padding, margin)\n */\n.navbar__links {\n\n}\n\n/* === Link ===\n * TODO: Color #374151, no text-decoration\n * TODO: Font-size 0.9375rem\n */\n.navbar__link {\n\n}\n\n.navbar__link:hover {\n  color: #3b82f6;\n}\n\n/* TODO: Active link should be #3b82f6 with font-weight 500 */\n.navbar__link--active {\n\n}\n\n/* === Action Button ===\n * TODO: Background #3b82f6, white text\n * TODO: Padding 0.5rem 1rem, border-radius 0.375rem, no border\n * TODO: Cursor pointer, font-size 0.875rem\n */\n.navbar__btn {\n\n}\n\n.navbar__btn:hover {\n  opacity: 0.9;\n}\n",
      "language": "css",
      "readonly": false
    }
  ],
  "test_config": {
    "test_file": "import { render, screen } from '@testing-library/react';\nimport '@testing-library/jest-dom';\nimport App from './App';\n\ndescribe('Flexbox Navbar', () => {\n  beforeEach(() => {\n    render(<App />);\n  });\n\n  it('navbar uses flexbox', () => {\n    const navbar = screen.getByTestId('navbar');\n    expect(getComputedStyle(navbar).display).toBe('flex');\n  });\n\n  it('navbar items are vertically centred', () => {\n    const navbar = screen.getByTestId('navbar');\n    expect(getComputedStyle(navbar).alignItems).toBe('center');\n  });\n\n  it('navbar has white background', () => {\n    const navbar = screen.getByTestId('navbar');\n    expect(getComputedStyle(navbar).backgroundColor).toBe('rgb(255, 255, 255)');\n  });\n\n  it('links container fills remaining space', () => {\n    const links = screen.getByTestId('links');\n    const flex = getComputedStyle(links).flex;\n    // flex: 1 computes to '1' or '1 1 0%' etc.\n    expect(flex).toMatch(/^1/);\n  });\n\n  it('links are displayed as flex', () => {\n    const links = screen.getByTestId('links');\n    expect(getComputedStyle(links).display).toBe('flex');\n  });\n\n  it('links are centred', () => {\n    const links = screen.getByTestId('links');\n    expect(getComputedStyle(links).justifyContent).toBe('center');\n  });\n\n  it('action button has blue background', () => {\n    const btn = screen.getByTestId('action');\n    expect(getComputedStyle(btn).backgroundColor).toBe('rgb(59, 130, 246)');\n  });\n\n  it('action button has white text', () => {\n    const btn = screen.getByTestId('action');\n    expect(getComputedStyle(btn).color).toBe('rgb(255, 255, 255)');\n  });\n\n  it('action button has border-radius', () => {\n    const btn = screen.getByTestId('action');\n    expect(getComputedStyle(btn).borderRadius).toBe('0.375rem');\n  });\n});",
    "dependencies": {
      "@testing-library/react": "^14.0.0",
      "@testing-library/jest-dom": "^6.0.0"
    }
  },
  "solution_files": [
    {
      "path": "styles.css",
      "content": ".navbar {\n  display: flex;\n  align-items: center;\n  padding: 0.75rem 1.5rem;\n  background-color: #ffffff;\n  border-bottom: 1px solid #e5e7eb;\n}\n\n.navbar__logo {\n  display: flex;\n  align-items: center;\n  gap: 0.5rem;\n  font-weight: 600;\n  font-size: 1.125rem;\n}\n\n.navbar__logo-icon {\n  font-size: 1.25rem;\n}\n\n.navbar__logo-text {\n  color: #111827;\n}\n\n.navbar__links {\n  flex: 1;\n  display: flex;\n  justify-content: center;\n  align-items: center;\n  gap: 1.5rem;\n  list-style: none;\n  padding: 0;\n  margin: 0;\n}\n\n.navbar__link {\n  color: #374151;\n  text-decoration: none;\n  font-size: 0.9375rem;\n}\n\n.navbar__link:hover {\n  color: #3b82f6;\n}\n\n.navbar__link--active {\n  color: #3b82f6;\n  font-weight: 500;\n}\n\n.navbar__btn {\n  background-color: #3b82f6;\n  color: #ffffff;\n  padding: 0.5rem 1rem;\n  border-radius: 0.375rem;\n  border: none;\n  cursor: pointer;\n  font-size: 0.875rem;\n}\n\n.navbar__btn:hover {\n  opacity: 0.9;\n}\n",
      "language": "css"
    }
  ],
  "sort_order": 302
}
